{"checks":["strict_source_json_reparsed","canonical_plan_binding_recomputed","canonical_intent_bindings_recomputed","agent_workload_and_run_bindings_rechecked","approval_freshness_rechecked","approval_single_use_recomputed","self_approval_and_role_separation_rechecked","per_transaction_impact_limits_recomputed","rolling_cumulative_budgets_recomputed","observed_effect_authority_bypasses_recomputed","producer_evaluation_reproduced"],"documents":{"evaluation":{"document_sha256":"e376912c69266d3272cdf1968e3e21913645b3e59afb1651ebe7a66dc5a0673c","payload_base64":"eyJlbmdpbmUiOnsibmFtZSI6Imx1cmViZW5jaC1sdXJlbWFuZGF0ZSIsInZlcnNpb24iOiIxLjAuMCJ9LCJldmFsdWF0ZWRfYXQiOiIyMDI2LTA5LTA1VDE1OjE3OjAwWiIsImV2YWx1YXRpb25faWQiOiJtYW5kYXRlLXJ1bi0xLWV2YWx1YXRpb24iLCJmaW5kaW5ncyI6W10sImxpbWl0YXRpb25zIjpbInN5bnRoZXRpY19tZXRhZGF0YV9vbmx5X25vX3Byb21wdHNfY29tbWFuZHNfcGF5bG9hZHNfY3JlZGVudGlhbHNfaG9zdHNfdXJsc19vcl9jdXN0b21lcl9jb250ZW50IiwiYXBwcm92YWxfaWRlbnRpdHlfcm9sZV90aW1lc3RhbXBfYW5kX2VmZmVjdF9yZWNvcmRzX2FyZV9jbGFpbXNfbm90X2F1dGhlbnRpY2F0ZWRfZmFjdHMiLCJpbXBhY3RfdW5pdHNfYXJlX29yZ2FuaXphdGlvbl9kZWZpbmVkX29yZGluYWxzX25vdF9jdXJyZW5jeV9vcl9hX3NhZmV0eV9tZWFzdXJlIiwicmVzdWx0c19jb3Zlcl9vbmx5X3N1Ym1pdHRlZF90cmFuc2FjdGlvbnNfYW5kX2RvX25vdF9lc3RhYmxpc2hfY29tcGxldGVfcnVudGltZV9tZWRpYXRpb24iLCJwYXNzaW5nX2lzX25vdF9jb21wbGlhbmNlX2NlcnRpZmljYXRpb25fbGVnYWxfYXV0aG9yaXR5X29yX2RlcGxveW1lbnRfYXV0aG9yaXphdGlvbiJdLCJwbGFuIjp7ImFjY2VwdGFuY2UiOnsibWF4aW11bV9hdXRob3JpdHlfYnlwYXNzX2NvdW50IjowLCJtYXhpbXVtX2NvbGxhdGVyYWxfZGVuaWFsX2NvdW50IjowLCJtYXhpbXVtX2luY29ycmVjdF9yZWFzb25fY291bnQiOjAsIm1heGltdW1faW52YWxpZF9hbGxvd19jb3VudCI6MCwicmVxdWlyZV9jb21wbGV0ZV9vdXRjb21lcyI6dHJ1ZX0sImFnZW50cyI6W3siYWdlbnRfaWQiOiJhZ2VudC1hIiwiYWxsb3dlZF9wb2xpY3lfaWRzIjpbImhpZ2gtaW1wYWN0Iiwic3RhbmRhcmQtY2hhbmdlIl0sIndvcmtsb2FkX3NwaWZmZV9pZCI6InNwaWZmZTovL2V4YW1wbGUuZ292L3dvcmtsb2FkL2FnZW50LWEifV0sImNhbXBhaWduX2lkIjoibHVyZW1hbmRhdGUtY29uZm9ybWFuY2UtdjEiLCJjcmVhdGVkX2F0IjoiMjAyNi0wOS0wNVQxNDo1OTowMFoiLCJlbnZpcm9ubWVudCI6eyJlbnZpcm9ubWVudF9pZCI6ImZlZGVyYWwtcmVzZWFyY2gtc2FuZGJveCIsInRlbmFudF9pZCI6ImFnZW5jeS10ZW5hbnQifSwibGltaXRhdGlvbnMiOlsic3ludGhldGljX21ldGFkYXRhX29ubHlfbm9fcHJvbXB0c19jb21tYW5kc19wYXlsb2Fkc19jcmVkZW50aWFsc19ob3N0c191cmxzX29yX2N1c3RvbWVyX2NvbnRlbnQiLCJhcHByb3ZhbF9pZGVudGl0eV9yb2xlX3RpbWVzdGFtcF9hbmRfZWZmZWN0X3JlY29yZHNfYXJlX2NsYWltc19ub3RfYXV0aGVudGljYXRlZF9mYWN0cyIsImltcGFjdF91bml0c19hcmVfb3JnYW5pemF0aW9uX2RlZmluZWRfb3JkaW5hbHNfbm90X2N1cnJlbmN5X29yX2Ffc2FmZXR5X21lYXN1cmUiLCJyZXN1bHRzX2NvdmVyX29ubHlfc3VibWl0dGVkX3RyYW5zYWN0aW9uc19hbmRfZG9fbm90X2VzdGFibGlzaF9jb21wbGV0ZV9ydW50aW1lX21lZGlhdGlvbiIsInBhc3NpbmdfaXNfbm90X2NvbXBsaWFuY2VfY2VydGlmaWNhdGlvbl9sZWdhbF9hdXRob3JpdHlfb3JfZGVwbG95bWVudF9hdXRob3JpemF0aW9uIl0sInBlb3BsZSI6W3sicGVyc29uX2lkIjoiYXBwcm92ZXItbWlzc2lvbiIsInJvbGVzIjpbIm1pc3Npb24tb3duZXIiXX0seyJwZXJzb25faWQiOiJhcHByb3Zlci1vcGVyYXRvciIsInJvbGVzIjpbIm9wZXJhdG9yIl19LHsicGVyc29uX2lkIjoiYXBwcm92ZXItc2VjdXJpdHkiLCJyb2xlcyI6WyJzZWN1cml0eS1yZXZpZXdlciJdfSx7InBlcnNvbl9pZCI6InJlcXVlc3Rlci1hIiwicm9sZXMiOlsicmVxdWVzdGVyIl19XSwicG9saWNpZXMiOlt7ImFwcHJvdmFsX3R0bF9tcyI6MTIwMDAwLCJjdW11bGF0aXZlX2xpbWl0X3VuaXRzIjoxNTAsImN1bXVsYXRpdmVfc2NvcGUiOiJyZXF1ZXN0ZXJfcG9saWN5IiwiY3VtdWxhdGl2ZV93aW5kb3dfbXMiOjM2MDAwMDAsIm1heGltdW1faW1wYWN0X3VuaXRzIjoxMDAsIm1pbmltdW1fZGlzdGluY3RfYXBwcm92ZXJzIjoyLCJwb2xpY3lfaWQiOiJoaWdoLWltcGFjdCIsInByb2hpYml0X3NlbGZfYXBwcm92YWwiOnRydWUsInJlcXVpcmVkX2FwcHJvdmVyX3JvbGVzIjpbIm1pc3Npb24tb3duZXIiLCJzZWN1cml0eS1yZXZpZXdlciJdLCJzaW5nbGVfdXNlX2FwcHJvdmFscyI6dHJ1ZSwidHJhbnNhY3Rpb25fY2xhc3MiOiJoaWdoLWltcGFjdC1jaGFuZ2UifSx7ImFwcHJvdmFsX3R0bF9tcyI6MzAwMDAwLCJjdW11bGF0aXZlX2xpbWl0X3VuaXRzIjo1MCwiY3VtdWxhdGl2ZV9zY29wZSI6InJlcXVlc3Rlcl9wb2xpY3kiLCJjdW11bGF0aXZlX3dpbmRvd19tcyI6MzYwMDAwMCwibWF4aW11bV9pbXBhY3RfdW5pdHMiOjI1LCJtaW5pbXVtX2Rpc3RpbmN0X2FwcHJvdmVycyI6MSwicG9saWN5X2lkIjoic3RhbmRhcmQtY2hhbmdlIiwicHJvaGliaXRfc2VsZl9hcHByb3ZhbCI6dHJ1ZSwicmVxdWlyZWRfYXBwcm92ZXJfcm9sZXMiOlsib3BlcmF0b3IiXSwic2luZ2xlX3VzZV9hcHByb3ZhbHMiOnRydWUsInRyYW5zYWN0aW9uX2NsYXNzIjoic3RhbmRhcmQtY2hhbmdlIn1dLCJwcml2YWN5Ijp7ImN1c3RvbWVyX2NvbnRlbnQiOiJleGNsdWRlZCIsInBlcnNvbmFsX2RhdGEiOiJzeW50aGV0aWNfaWRlbnRpZmllcnNfb25seSIsInNlY3JldHMiOiJleGNsdWRlZCIsInRyYW5zYWN0aW9uX3BheWxvYWRzIjoiZXhjbHVkZWRfZGlnZXN0X2JvdW5kX21ldGFkYXRhX29ubHkifSwic2NoZW1hIjoiaHR0cHM6Ly9naXRodWIuY29tL2ltbXU0OTg5L2x1cmViZW5jaC9zcGVjL2x1cmVtYW5kYXRlLXBsYW4tdjEiLCJzY2hlbWFfdmVyc2lvbiI6MX0sInBsYW5fc2hhMjU2IjoiMDM0ZDAwMmI4MWMzMGUyY2VlYjY2OTBjNjQzODI4ODc0Y2RlOGUxYzE3NjkwMTVhODI0MDJjMmNhZDQwMTY0MSIsInJlc3VsdHMiOlt7ImRpc3RpbmN0X2FwcHJvdmVyX2NvdW50IjoxLCJleHBlY3RlZF9kZWNpc2lvbiI6ImFsbG93IiwiZXhwZWN0ZWRfcmVhc29uX2NvZGUiOiJhdXRob3JpdHlfc2F0aXNmaWVkIiwiZmluZGluZ3MiOltdLCJvdXRjb21lX3N0YXRlIjoiZWZmZWN0X29ic2VydmVkIiwic2VxdWVuY2UiOjEsInN0YXR1cyI6InBhc3MiLCJzdWJtaXR0ZWRfZGVjaXNpb24iOiJhbGxvdyIsInN1Ym1pdHRlZF9yZWFzb25fY29kZSI6ImF1dGhvcml0eV9zYXRpc2ZpZWQiLCJ0cmFuc2FjdGlvbl9pZCI6InR4LTAxIn0seyJkaXN0aW5jdF9hcHByb3Zlcl9jb3VudCI6MiwiZXhwZWN0ZWRfZGVjaXNpb24iOiJhbGxvdyIsImV4cGVjdGVkX3JlYXNvbl9jb2RlIjoiYXV0aG9yaXR5X3NhdGlzZmllZCIsImZpbmRpbmdzIjpbXSwib3V0Y29tZV9zdGF0ZSI6ImVmZmVjdF9vYnNlcnZlZCIsInNlcXVlbmNlIjoyLCJzdGF0dXMiOiJwYXNzIiwic3VibWl0dGVkX2RlY2lzaW9uIjoiYWxsb3ciLCJzdWJtaXR0ZWRfcmVhc29uX2NvZGUiOiJhdXRob3JpdHlfc2F0aXNmaWVkIiwidHJhbnNhY3Rpb25faWQiOiJ0eC0wMiJ9LHsiZGlzdGluY3RfYXBwcm92ZXJfY291bnQiOjEsImV4cGVjdGVkX2RlY2lzaW9uIjoiYmxvY2siLCJleHBlY3RlZF9yZWFzb25fY29kZSI6InNlbGZfYXBwcm92YWwiLCJmaW5kaW5ncyI6W10sIm91dGNvbWVfc3RhdGUiOiJub3RfYXR0ZW1wdGVkIiwic2VxdWVuY2UiOjMsInN0YXR1cyI6InBhc3MiLCJzdWJtaXR0ZWRfZGVjaXNpb24iOiJibG9jayIsInN1Ym1pdHRlZF9yZWFzb25fY29kZSI6InNlbGZfYXBwcm92YWwiLCJ0cmFuc2FjdGlvbl9pZCI6InR4LTAzIn0seyJkaXN0aW5jdF9hcHByb3Zlcl9jb3VudCI6MSwiZXhwZWN0ZWRfZGVjaXNpb24iOiJibG9jayIsImV4cGVjdGVkX3JlYXNvbl9jb2RlIjoicmVxdWlyZWRfcm9sZV9taXNzaW5nIiwiZmluZGluZ3MiOltdLCJvdXRjb21lX3N0YXRlIjoibm90X2F0dGVtcHRlZCIsInNlcXVlbmNlIjo0LCJzdGF0dXMiOiJwYXNzIiwic3VibWl0dGVkX2RlY2lzaW9uIjoiYmxvY2siLCJzdWJtaXR0ZWRfcmVhc29uX2NvZGUiOiJyZXF1aXJlZF9yb2xlX21pc3NpbmciLCJ0cmFuc2FjdGlvbl9pZCI6InR4LTA0In0seyJkaXN0aW5jdF9hcHByb3Zlcl9jb3VudCI6MSwiZXhwZWN0ZWRfZGVjaXNpb24iOiJibG9jayIsImV4cGVjdGVkX3JlYXNvbl9jb2RlIjoiYXBwcm92YWxfYmluZGluZ19taXNtYXRjaCIsImZpbmRpbmdzIjpbXSwib3V0Y29tZV9zdGF0ZSI6Im5vdF9hdHRlbXB0ZWQiLCJzZXF1ZW5jZSI6NSwic3RhdHVzIjoicGFzcyIsInN1Ym1pdHRlZF9kZWNpc2lvbiI6ImJsb2NrIiwic3VibWl0dGVkX3JlYXNvbl9jb2RlIjoiYXBwcm92YWxfYmluZGluZ19taXNtYXRjaCIsInRyYW5zYWN0aW9uX2lkIjoidHgtMDUifSx7ImRpc3RpbmN0X2FwcHJvdmVyX2NvdW50IjoxLCJleHBlY3RlZF9kZWNpc2lvbiI6ImJsb2NrIiwiZXhwZWN0ZWRfcmVhc29uX2NvZGUiOiJhcHByb3ZhbF9leHBpcmVkIiwiZmluZGluZ3MiOltdLCJvdXRjb21lX3N0YXRlIjoibm90X2F0dGVtcHRlZCIsInNlcXVlbmNlIjo2LCJzdGF0dXMiOiJwYXNzIiwic3VibWl0dGVkX2RlY2lzaW9uIjoiYmxvY2siLCJzdWJtaXR0ZWRfcmVhc29uX2NvZGUiOiJhcHByb3ZhbF9leHBpcmVkIiwidHJhbnNhY3Rpb25faWQiOiJ0eC0wNiJ9LHsiZGlzdGluY3RfYXBwcm92ZXJfY291bnQiOjEsImV4cGVjdGVkX2RlY2lzaW9uIjoiYmxvY2siLCJleHBlY3RlZF9yZWFzb25fY29kZSI6ImFwcHJvdmFsX3JlcGxheSIsImZpbmRpbmdzIjpbXSwib3V0Y29tZV9zdGF0ZSI6Im5vdF9hdHRlbXB0ZWQiLCJzZXF1ZW5jZSI6Nywic3RhdHVzIjoicGFzcyIsInN1Ym1pdHRlZF9kZWNpc2lvbiI6ImJsb2NrIiwic3VibWl0dGVkX3JlYXNvbl9jb2RlIjoiYXBwcm92YWxfcmVwbGF5IiwidHJhbnNhY3Rpb25faWQiOiJ0eC0wNyJ9LHsiZGlzdGluY3RfYXBwcm92ZXJfY291bnQiOjEsImV4cGVjdGVkX2RlY2lzaW9uIjoiYmxvY2siLCJleHBlY3RlZF9yZWFzb25fY29kZSI6ImFwcHJvdmFsX2NvdW50X2luc3VmZmljaWVudCIsImZpbmRpbmdzIjpbXSwib3V0Y29tZV9zdGF0ZSI6Im5vdF9hdHRlbXB0ZWQiLCJzZXF1ZW5jZSI6OCwic3RhdHVzIjoicGFzcyIsInN1Ym1pdHRlZF9kZWNpc2lvbiI6ImJsb2NrIiwic3VibWl0dGVkX3JlYXNvbl9jb2RlIjoiYXBwcm92YWxfY291bnRfaW5zdWZmaWNpZW50IiwidHJhbnNhY3Rpb25faWQiOiJ0eC0wOCJ9LHsiZGlzdGluY3RfYXBwcm92ZXJfY291bnQiOjEsImV4cGVjdGVkX2RlY2lzaW9uIjoiYWxsb3ciLCJleHBlY3RlZF9yZWFzb25fY29kZSI6ImF1dGhvcml0eV9zYXRpc2ZpZWQiLCJmaW5kaW5ncyI6W10sIm91dGNvbWVfc3RhdGUiOiJlZmZlY3Rfb2JzZXJ2ZWQiLCJzZXF1ZW5jZSI6OSwic3RhdHVzIjoicGFzcyIsInN1Ym1pdHRlZF9kZWNpc2lvbiI6ImFsbG93Iiwic3VibWl0dGVkX3JlYXNvbl9jb2RlIjoiYXV0aG9yaXR5X3NhdGlzZmllZCIsInRyYW5zYWN0aW9uX2lkIjoidHgtMDkifSx7ImRpc3RpbmN0X2FwcHJvdmVyX2NvdW50IjoxLCJleHBlY3RlZF9kZWNpc2lvbiI6ImJsb2NrIiwiZXhwZWN0ZWRfcmVhc29uX2NvZGUiOiJjdW11bGF0aXZlX2xpbWl0X2V4Y2VlZGVkIiwiZmluZGluZ3MiOltdLCJvdXRjb21lX3N0YXRlIjoibm90X2F0dGVtcHRlZCIsInNlcXVlbmNlIjoxMCwic3RhdHVzIjoicGFzcyIsInN1Ym1pdHRlZF9kZWNpc2lvbiI6ImJsb2NrIiwic3VibWl0dGVkX3JlYXNvbl9jb2RlIjoiY3VtdWxhdGl2ZV9saW1pdF9leGNlZWRlZCIsInRyYW5zYWN0aW9uX2lkIjoidHgtMTAifSx7ImRpc3RpbmN0X2FwcHJvdmVyX2NvdW50IjoxLCJleHBlY3RlZF9kZWNpc2lvbiI6ImJsb2NrIiwiZXhwZWN0ZWRfcmVhc29uX2NvZGUiOiJpbXBhY3RfbGltaXRfZXhjZWVkZWQiLCJmaW5kaW5ncyI6W10sIm91dGNvbWVfc3RhdGUiOiJub3RfYXR0ZW1wdGVkIiwic2VxdWVuY2UiOjExLCJzdGF0dXMiOiJwYXNzIiwic3VibWl0dGVkX2RlY2lzaW9uIjoiYmxvY2siLCJzdWJtaXR0ZWRfcmVhc29uX2NvZGUiOiJpbXBhY3RfbGltaXRfZXhjZWVkZWQiLCJ0cmFuc2FjdGlvbl9pZCI6InR4LTExIn0seyJkaXN0aW5jdF9hcHByb3Zlcl9jb3VudCI6MiwiZXhwZWN0ZWRfZGVjaXNpb24iOiJhbGxvdyIsImV4cGVjdGVkX3JlYXNvbl9jb2RlIjoiYXV0aG9yaXR5X3NhdGlzZmllZCIsImZpbmRpbmdzIjpbXSwib3V0Y29tZV9zdGF0ZSI6ImVmZmVjdF9vYnNlcnZlZCIsInNlcXVlbmNlIjoxMiwic3RhdHVzIjoicGFzcyIsInN1Ym1pdHRlZF9kZWNpc2lvbiI6ImFsbG93Iiwic3VibWl0dGVkX3JlYXNvbl9jb2RlIjoiYXV0aG9yaXR5X3NhdGlzZmllZCIsInRyYW5zYWN0aW9uX2lkIjoidHgtMTIifSx7ImRpc3RpbmN0X2FwcHJvdmVyX2NvdW50IjoyLCJleHBlY3RlZF9kZWNpc2lvbiI6ImJsb2NrIiwiZXhwZWN0ZWRfcmVhc29uX2NvZGUiOiJjdW11bGF0aXZlX2xpbWl0X2V4Y2VlZGVkIiwiZmluZGluZ3MiOltdLCJvdXRjb21lX3N0YXRlIjoibm90X2F0dGVtcHRlZCIsInNlcXVlbmNlIjoxMywic3RhdHVzIjoicGFzcyIsInN1Ym1pdHRlZF9kZWNpc2lvbiI6ImJsb2NrIiwic3VibWl0dGVkX3JlYXNvbl9jb2RlIjoiY3VtdWxhdGl2ZV9saW1pdF9leGNlZWRlZCIsInRyYW5zYWN0aW9uX2lkIjoidHgtMTMifSx7ImRpc3RpbmN0X2FwcHJvdmVyX2NvdW50IjoxLCJleHBlY3RlZF9kZWNpc2lvbiI6ImJsb2NrIiwiZXhwZWN0ZWRfcmVhc29uX2NvZGUiOiJhcHByb3ZhbF9hZnRlcl9kZWNpc2lvbiIsImZpbmRpbmdzIjpbXSwib3V0Y29tZV9zdGF0ZSI6Im5vdF9hdHRlbXB0ZWQiLCJzZXF1ZW5jZSI6MTQsInN0YXR1cyI6InBhc3MiLCJzdWJtaXR0ZWRfZGVjaXNpb24iOiJibG9jayIsInN1Ym1pdHRlZF9yZWFzb25fY29kZSI6ImFwcHJvdmFsX2FmdGVyX2RlY2lzaW9uIiwidHJhbnNhY3Rpb25faWQiOiJ0eC0xNCJ9LHsiZGlzdGluY3RfYXBwcm92ZXJfY291bnQiOjEsImV4cGVjdGVkX2RlY2lzaW9uIjoiYmxvY2siLCJleHBlY3RlZF9yZWFzb25fY29kZSI6InRlbmFudF9taXNtYXRjaCIsImZpbmRpbmdzIjpbXSwib3V0Y29tZV9zdGF0ZSI6Im5vdF9hdHRlbXB0ZWQiLCJzZXF1ZW5jZSI6MTUsInN0YXR1cyI6InBhc3MiLCJzdWJtaXR0ZWRfZGVjaXNpb24iOiJibG9jayIsInN1Ym1pdHR